subreddit,permalink,score,num_comments,title,body_text,image_url
Medicine,https://old.reddit.com/r/medicine/comments/g33lll/ive_read_this_three_times_today_in_the_notes_and/,3084,455,I’ve read this three times today in the notes and it drives me mad.,"Aspiration pneumonia is a thing - it’s a recognised term in pathology.
Aspirational pneumonia is not. Maybe it really really wants to be, and it’s struggling and striving and working towards its dream, but it’s not.",
Medicine,https://old.reddit.com/r/medicine/comments/43lv04/american_medical_association_votes_to_ban/,3078,136,American Medical Association votes to BAN prescription drug commercials,,
Medicine,https://old.reddit.com/r/medicine/comments/g7sph9/epic_was_ready/,3041,197,Epic was ready.,,https://i.redd.it/u5c8q9rkjyu41.jpg
Medicine,https://old.reddit.com/r/medicine/comments/pl3g2w/biden_to_announce_all_health_care_facilities_must/,3024,484,Biden to announce all health care facilities must have their staff fully vaccinated in order to be reimbursed by Medicare and Medicaid,,
Medicine,https://old.reddit.com/r/medicine/comments/g4wmjz/nyu_im_resident_speaks_up_about_how_her/,3002,431,NYU IM resident speaks up about how her institution has treated residents during COVID.,,
Medicine,https://old.reddit.com/r/medicine/comments/ke7z64/im_a_medical_student_and_while_assisting_on_a/,2993,93,"I'm a medical student, and while assisting on a COVID ward, I photographed 67 NHS hospital staff.",,
Medicine,https://old.reddit.com/r/medicine/comments/fu7oc3/im_scared/,2962,95,I’m Scared.,,
Medicine,https://old.reddit.com/r/medicine/comments/kycvqn/the_cherokee_nation_and_oklahoma_state_university/,2888,157,"The Cherokee Nation and Oklahoma State University make history today, opening the first tribally affiliated medical school on tribal land in the United States.",,
Medicine,https://old.reddit.com/r/medicine/comments/cqg6by/a_living_human_circle_of_willis/,2860,92,A living human circle of Willis,,
Medicine,https://old.reddit.com/r/medicine/comments/jcajpj/doctors_and_nurses_working_in_both_covid_and/,2833,54,"Doctors and nurses working in both covid and non-covid government run hospitals in New Delhi, India (the capital city) have not been paid their salary since the last 4 MONTHS. They have been on a partial strike (emergency is still operating) since the last 2-5 days with very little media coverage",,
Medicine,https://old.reddit.com/r/medicine/comments/139xz4j/georgia_signs_into_law_banning_nps_and_pas_from/,2789,461,Georgia signs into law banning NPs and PAs from using the term Doctor in clinical venues,,
Medicine,https://old.reddit.com/r/medicine/comments/rsy3un/i_think_the_next_46_weeks_might_just_be_the/,2796,556,I think the next 4-6 weeks might just be the breaking point for Medicine,,
Medicine,https://old.reddit.com/r/medicine/comments/rchfms/exhausted_by_covid/,2797,614,Exhausted by Covid,,
Medicine,https://old.reddit.com/r/medicine/comments/fs04fo/famed_pediatric_neurosurgeon_jim_goodrich_dead_of/,2763,105,Famed pediatric neurosurgeon Jim Goodrich dead of coronavirus,,
Medicine,https://old.reddit.com/r/medicine/comments/j5cj30/my_dad_has_been_a_physician_for_almost_50_years/,2709,44,"My dad has been a physician for almost 50 years and is nearing retirement. This week, he received this letter from an old friend and colleague he hasn’t seen in decades who now teaches at the med school they both attended. I couldn’t be more proud.",,
Medicine,https://old.reddit.com/r/medicine/comments/fmk3pw/essay_from_josh_lerner_md_after_the_cdc_loosens/,2699,240,"Essay from Josh Lerner, MD after the CDC loosens guidelines for all of us on the front lines",,
Medicine,https://old.reddit.com/r/medicine/comments/gx70ai/shes_a_fighter_i_want_everything_done/,2689,366,"“She’s a fighter, I want everything done.”",,
Medicine,https://old.reddit.com/r/medicine/comments/w17t3n/woman_bleeds_out_from_miscarriage_and_put_on/,2655,484,Woman bleeds out from miscarriage and put on breathing machine due to abortion laws,,
Medicine,https://old.reddit.com/r/medicine/comments/vjpisy/roe_v_wade_has_officially_been_overturned/,2642,1073,Roe v. Wade has officially been overturned.,,
Medicine,https://old.reddit.com/r/medicine/comments/j4ocb1/some_interesting_tidbits_about_the_white_house/,2637,237,Some interesting tidbits about the White House Physician,,
Medicine,https://old.reddit.com/r/medicine/comments/j8rqmg/dr_fauci_named_federal_employee_of_the_year/,2611,59,Dr. Fauci Named Federal Employee of the Year,,
Medicine,https://old.reddit.com/r/medicine/comments/126q7w8/after_spending_30_minutes_on_the_phone_today/,2577,313,"After spending 30 minutes on the phone today trying to get a prior auth, the woman told me I’d have to submit at least three peer-reviewed studies on why my patient (a 1.5 year old) needs the liquid medication rather than the pill that’s on formulary.",,
Medicine,https://old.reddit.com/r/medicine/comments/1igp35p/follow_up_the_doctor_who_was_pulled_out_of/,2562,172,Follow up: The doctor who was pulled out of surgery to call UHC because they were denying her patient’s stay got a threatening letter from UHC for talking about it on social media.,,
Medicine,https://old.reddit.com/r/medicine/comments/mm6rnf/if_physicians_spent_even_half_the_energy_they/,2550,517,"If physicians spent even half the energy they spend worrying about midlevels on the confronting the actual villains in our profession (business administrators, politicians, and drug companies), we might actually be able to fix the American health care system.",,
Medicine,https://old.reddit.com/r/medicine/comments/knf17i/new_virginia_law_capping_insulin_prices_at_50_a/,2539,207,New Virginia law capping insulin prices at $50 a month goes into effect Friday,,
Medicine,https://old.reddit.com/r/medicine/comments/kg7576/stanford_hospital_erupted_in_protest_after/,2535,255,"Stanford hospital erupted in protest after vaccine plan left out residents. As a response, they issued an apology and announced they would re-prioritize vaccine distributions immediately in order to move more of its front-line staff into the first wave of vaccinations.",,
Medicine,https://old.reddit.com/r/medicine/comments/pt33nl/finally_saw_a_complication_of_masking/,2519,205,Finally saw a complication of masking,,
Medicine,https://old.reddit.com/r/medicine/comments/1b0eok0/i_am_dr_glaucomflecken_ask_me_anything/,2500,680,I am Dr. Glaucomflecken! Ask Me Anything.,,
Medicine,https://old.reddit.com/r/medicine/comments/1itlwgm/gov_evers_i_want_wisconsin_to_become_the_first/,2491,65,Gov. Evers: “I Want Wisconsin to Become the First State in America to Start Auditing Insurance Companies over Denying Healthcare Claims”,,
Medicine,https://old.reddit.com/r/medicine/comments/h0lo6e/weve_just_given_up_on_covid_havent_we/,2488,690,We've just given up on COVID haven't we?,,
Medicine,https://old.reddit.com/r/medicine/comments/gomrrv/former_nurse_practitioner_for_nearly_a_decade/,2489,223,"Former Nurse Practitioner for nearly a decade, Kudji got her MD, and now matched into residency together with her daughter. They both start this July at LSU Health in Louisiana.",,
Medicine,https://old.reddit.com/r/medicine/comments/tn9xcw/study_comparing_apps_vs_physicians_as_pcp_for/,2476,446,"Study comparing APPs vs Physicians as PCP for 30,000+ patients: physicians provided higher level care at significantly less cost(less testreferrals), higher on 9 out of 10 quality measures, less ED utilization, and higher patient satisfaction across all 6 domains measured by Press Ganey.",,
Medicine,https://old.reddit.com/r/medicine/comments/foreet/ventilator_triage_warninggraphic/,2474,320,Ventilator triage. Warning:graphic,,
Medicine,https://old.reddit.com/r/medicine/comments/gab0xu/an_nyp_emergency_medicine_doctor_recently/,2453,162,"An NYP emergency medicine doctor recently committed suicide. “She tried to do her job and it killed her."" Remember: an administrator at the same institution previously threatened concerned staff with professional retaliation on video. Poor leadership must be eliminated from healthcare.",,
Medicine,https://old.reddit.com/r/medicine/comments/gt7ax9/sudden_clarity_on_why_its_called_insulin/,2450,225,Sudden clarity on why it's called insulin.,"Was sitting at work reading something about insulin and it hit me:
Insula is Latin for island.
It's made in the islets (""little Islands"") of Langerhans.
Insulin is ""island hormone.""
Can't believe I've never connected the dots before.",
Medicine,https://old.reddit.com/r/medicine/comments/5gatdy/at_a_hospital_in_india/,2403,87,At a hospital in India,,
Medicine,https://old.reddit.com/r/medicine/comments/uvcijm/a_pediatricians_guide_to_navigating_the_formula/,2345,310,A pediatrician's guide to navigating the formula shortage,"As the nationwide formula-shortage drags on, I am shocked by the lack of leadership from the professional medical societies in helping parents safely feed their infants. The AAP's official position has simply been ""tell your patients to shop around and don't consider any alternatives,"" which is literally useless. The current nutritional guidelines are heavily influenced by formula manufacturers and the milk lobby and I wish the AAP would seize this opportunity to break their grip.
Like many of the medical professionals on this forum I am seeing desperate parents (both at work and socially) who are struggling to feed their infants, and I wanted to take a minute to put my advice in writing. Maybe you guys will find it useful too. So here is the advice I am giving my patients, as a board certified pediatrician and as a father of two.
This advice applies to healthy infants, and will not be appropriate for significantly premature babies (born less than 36 weeks gestation) or infants with heart, kidney, liver, intestinal, digestive, or allergic diseases. If you are going to deviate from the AAP’s recommendations, have a chat with your pediatrician too and make sure that they agree with me, and that this plan is suitable for
your
baby.
Under 4 months
, infants need breastmilk or
infant
formula. There really is no safe substitute, and formula distribution should prioritize these babies.  If you cannot get your usual formula, consider some options:
A different infant formula. The difference between brands, or cow’s milk-based vs soy-based vs other plant-based infant formula are negligible and you can use any of them with confidence.
Hydrolyzed and amino acid formulas, while expensive and designed for babies with certain digestive issues, are nutritionally complete and are safe to give to healthy infants. They smell awful but babies don’t care.
Infant formula for premature babies is a little more calorie dense and contains a little more protein than stanard infant formula, but will do in a pinch.
European, Canadian, or UK infant formulas are great. Be sure to read the mixing instructions, as they often have a different scoop-to-water ratio than US formulas. If you are importing these, be sure that it is from a source you trust.
Breastfeeding mothers might want to
try increasing their supply.
This is easier said than done. Remember that US law requires your employer
give you time to express milk and a private space that is not a bathroom each time you need to pump
. This is one of the few areas of maternal-infant health in which US law doesn’t completely suck.
The following are
NOT
safe alternatives
Home made formula. Will likely have the wrong balance of macronutrients but will certainly lack important micronutrients. Often has a dangerously different osmolality. Infants eat whatever they are given and have dumb kidneys, so are prone to hyponatremia or hypernatremia and every pediatrician has seen a baby die this way. Don’t do it.
Diluting infant formula in insanely dangerous. Do not do this under any circumstances.
Toddler formulas (marketed for infants >12 months old), have more calories per ounce than infant formula and consequently a “meal” with toddler formula will contain less free water. In an infant this will cause constipation and hypernatremia/dehydration. I suppose if you had literally nothing else to give, but this is not a long-term solution, or even a week-long solution.
Between 4 and 6 months
, infants will still need some infant formula, but you have some options.
Solid food. You
should be starting solid foods at 4 months
, (
the AAP says 6 months
, but they are wrong). It is unlikely that solid food will make up a meaningful proportion of your baby’s diet until closer to 6 months, but you can start practicing with some rice or oatmeal cereal at 4 months. This is also a great opportunity to introduce allergens like peanut, egg, shellfish, tree nuts, and so on - the earlier they are introduced the less likely you are to develop an allergy. There are various products
like SpoonfulOne
that contain small amounts of the 16 most common allergens which you can mix into your 4 month old’s cereal.
Toddler formulas may be more calorically dense (and, consequently, have less free water) and still aren't ideal but it terrifies me less at this age. Not safe for long-term use but could get you through a weekend.
Between 6 and 9 months
you can really ramp up food+water (and consequently decrease your reliance on formula). The infant now has distinct hunger and thirst mechanisms so it will appropriately choose between food and water when hungry or thirsty. This means you could offer one bottle of toddler formula and a small amount of plain water and trust the baby to balance its calories vs fluid. But it also means that you can feed the baby a meaningful amount of food. By 9 months old I like my patients to be getting the large majority of their nutrition from food.
It is worth being familiar with
the macronutritional requirements of infants,
because they are pretty different than a typical American adult's diet. Total calories vary by sex/weight, but is typically around 600-800 calories/day. I encourage parents to be flexible with this, and you will see a normal infant's appetite vary hugely day to day or week to week. As long as you are offering good foods, just feed to satiation and don't sweat the details.
That said, here are the details. Daily intake (food+formula) at this age should include:
90-100 grams per day of carbohydrates
10-15 grams per day of protein
30 grams per day of fat taking special care to including a source of essential fatty acids including Linoleic acid and Arachidonic acid (5g/day) and α-Linolenic acid and Docosahexaenoic acid (0.5 g/day). You will find these in eggs, fish, olive oil, and cheese
There are a lot of micronutrient requirements but the simplest way to meet them is to use
a fortified grain cereal as your base
and mix in various pureed things. If you don't want to use a fortified cereal for some reason, take care to ensure that your baby is getting 1 mg/kg/day of iron and 400 IU/day of vitamin D. You will probably need supplements to achieve this.
Don't hold back on the variety of food. Vegetables, meat, fruit, seafood, nuts, everything. If the food is safe for you, it is safe for the baby (except honey - no honey until 12 months). Explore strong flavors and a variety of textures. Be mindful of choking hazards (peanuts, small grapes, etc). Finger foods are fun and great for motor skills, but your infant will not consume many calories on finger foods alone.
After 9 months
just feed food. If you are struggling to meet the fat requirements above, you can give some cow's milk. Infant formula is convenient but absolutely unnecessary at this age.
After 12 months
, baring a failure to thrive situation or a family that is hopeless at providing nutritious food, I actively discourage liquid calories. Children should eat food.
Common mistakes
to be aware of at all ages:
Goat's milk contains very little folate and its use as a primary calorie source causes megaloblastic anemia.
Cow's milk over 32 ounces per day impairs iron absorption and causes iron deficiency anemia
even if the diet contains otherwise adequate iron
. In children this is a hypercoagulable state and can cause cerebral venous sinus thrombosis. I have see this.
Plant ""milk"" (almond, oat, etc) is never appropriate for babies. Even the best of them have 50% the calories of human or cow milk, and 20% of the protein and fat.  Do not use. Plant-based infant formulas have added protein/fat and
are
safe.",
