subreddit,permalink,score,num_comments,title,body_text,image_url
Medicine,https://old.reddit.com/r/medicine/comments/fqnqmb/3_more_days_of_inpatient_care_in_new_york/,3397,241,3 More Days of Inpatient Care in New York,"Day 4
“The residents should run the Code Blues, they’re probably better trained than us.”
I’ll start off with what is good.
We’re becoming more adept at treating COVID cases. With a growing census of confirmed COVID positive patients (10 COVID positive in a census of 16 today), we’re getting a better sense of how this bastard virus behaves. There are the easy presentations: 40F w/ no significant PMH presenting w/ a 7 day hx of fever, dry cough, fatigue found to have bilateral ground glass infiltrates, elevated LFTs, lymphocytopenia and even fucking hypokalemia on admission. Might as well not even swab to confirm. (But the ED will, oh yes, because now they’re swabbing everyone and costing us probably 30-40 PPE kits per admission while we wait the 24 hours for the COVID test to result.)
But then there was the subtle one: 73M w/ multiple comorbidities who was diagnosed with simple CHF exacerbation and sepsis secondary to a UTI (positive UA and UCx) who was tubed on arrival to the ED, admitted straight to the ICU, found to be COVID negative 3/21. He is taken off the vent within 24 hours and discharged to the floors. Because he’s COVID negative you see. We treat him with antibiotics, work up his NSTEMI which he managed to throw in during his first day admitted and kind of take mild interest in his recurrent fevers. But he’s not coughing and is satting well.
Yesterday, my team and I thought “This guy has a normal white count, elevated LFTs and recurrent fevers. Forget the last test, order a repeat COVID.” I do this several hours before speaking with the attending physician. During table rounds, he pointedly asked me if I was aware of the protocols the Command Center had put in place for repeat testing. I say no, as these protocols change every day. (Side note: N95s are now rated for indefinite use, not just 4 days. Hope we didn’t toss all those other ones away for no reason!) “Cancel the test, let’s get Infectious Disease on board and ask them their input.”
I put in for the ID consult, I... ""forget"" to cancel the COVID repeat or inform the Command Center. Busy day as you saw from yesterday. Comes back positive.
We know what this bastard virus looks like.
But we spent 2-3 days in his room without our N95s on.
We would have spent more in there had we not tested.
We’re still early, but we know how fast or how slow a case progresses. Our younger patients, the 41F and the 49M might get discharged to home quarantine as early as tomorrow! They’re not reliant on supplemental oxygen and haven’t had fevers for >24 hours. Our older patients aren’t as lucky. No one on our census so far has been intubated. The 73M whose COVID we caught late rapidly progressed to requiring supplemental oxygen and was transferred to the SICU as the last stop before ventilator land.
We’re getting better as a team of residents. We’re all more than a little scared. I’ve talked to my favorite resident / current carpool buddy / best second-in-command about my anxiety about this situation. How the adrenaline kicks in when I’m on the floors and makes me feel less afraid and more focused. The crash after work is awful and the anxiety kicking back in takes a drink or two to knock down, but fuck it, I’m better at my work when I’m not terrified.
Oh and the food remains the best part of the day. Thank you, local places that sent great sandwiches for lunch and Greek for dinner. Makes the rest of this easier to write about.
Now on to what’s not good.
The hospital is now greater than 2/3rds COVID cases. The ratio of ventilators for COVID patients to non-COVID patients is 7:1.
We’re maxed out on the capacity of our Intensivists, intensivist PAs, and Anesthesiologists. The sprawl of the traditional ICU has taken over essentially anything that used to be elevated care and we’re still scrambling for beds. A handful of Internal and Family Med Hospitalists are being recruited to act as lieutenant Intensivists overseeing the ventilated. I mean lieutenant in its original definition: ""substitute,” “deputy,"" literally ""place holder."" They report to the Intensivists directly.
At lunch today, it was declared that due to the sheer number of Rapid Responses and Codes, and due to the overwhelming census of the Greater ICU, Residents responding to Rapid Responses are not expected to get any Intensivist backup.
I’m no stranger to Rapid Responses. You hear the call over the PA and are given a floor, you rush upstairs and enter a room blind with someone either choking, or unconscious, or bleeding, or seizing, or with a heart rate incompatible with life. You remain calm, you ask the patient questions while asking the nurses to give a summary of the patient’s medical background, current admission issues, latest changes, vitals, labs, imaging. Scary, but doable.
During the meeting, the Medical Director said the Hospitalists would be asked to run Code Blues. The Hospitalists balked.
See, Intensivists ran
every single Code Blue
in the hospital before now. One Hospitalist said, “We haven’t run a Code since residency! The residents should run the Code Blues, they’re probably better trained than us.” The room of a couple dozen full-blown-attending Hospitalists nodded in agreement. I was the only resident there, too stunned to speak up. No final decision was made.
I know the timing of Epi pushes and ACLS algorithms enough that a couple days’ review would cement it pretty well. But the actual pressure of making the call for a defibrillation or a push of atropine or adenosine is so beyond what I’m emotionally prepared for.
CPR is a violent, ugly thing with a fatality rate that is 100% for COVID patients with lungs too full of fluid for their heart pumping to matter. Even if I were to run everything perfectly, the person is still going to die. Let alone if I make the wrong call.
I’ve come to terms with the idea that I’m going to see COVID patients die under my care
a whole fucking lot.
I don’t want to be forced to watch them die under my care from three feet away while I make a series of life or death decisions that are guaranteed to be utterly pointless.
​
​
Day 5
“If you’re going to stroll around here, you’re going to need full PPE”
“Usually takes about 20 minutes, then everyone’s arms get tired”
If this hospital is at war, it’s ceding territory at an alarming rate.
Here’s the layout of the field: we’ve got medsurg wings on the cardinal points of the compass (except 2SW for some reason) in a somewhat random pattern from first floor to fifth: 1N, 2S, 2SW, 3N, 3E, 5E, 5S. The ICU, CCU, CICU, and SICU are floating around the periphery of the 3rd floor.
By the time I started Day 1, 2SW and 5E were already on lockdown and designated as COVID territory. My team alone had a total of two pending and one confirmed COVID cases.
By Day 2, the CICU became a conflict zone and joined 2S and 5E. 5 COVIDS or pendings.
By Day 3, my team had pending tests in 5S as well. 6 COVIDs or pendings.
By Day 4, the 5th and 2nd floors were entirely given over to COVID. 3E still had some non-COVID evacuees waiting to be transferred to the last bastions of 1N and 3N. Everything ending with -CU is overrun by this point.
It’s Day 5. My census stands at 15, of which 9 are COVID positive. There’s talk of clearing out 1N sooner or later even.
The hospital is fairing less well: of the 170 or so inpatients (not counting the 25 or so Greater ICU COVID positive people on vents), 100 are COVID positive, and a third more have pending tests.
…
So those are the numbers. Actually walking the halls puts the change from Day 1 to Day 5 in starker contrast.
The amount of PPE used per nurse or CNA has steadily increased. On any floor (except the Last Bastion wings), if you squint your eyes all you can see is uniform green paper scrubs with blue hairnets and and blue paper booties and blue paper masks +/- an N95 underneath. If you look further down the hall you’ll see a spray of yellow as one of them gowns up to enter a patient’s room. (The nurses have been using Sharpies to write their names on the paper gowns so people can tell each other apart.)
Maybe you’ll spot a Resident in a long white coat rush by.
And by every single door on wheeled tables usually topped with hospital food are boxes and boxes of blue gloves and yellow gowns. Might be my imagination, but the boxes of face masks are disconcertingly not as ubiquitous.
The Greater ICU is less colorful. Just window after window of people on vents. Walk the whole length of it and count maybe one person who’s conscious. Most don’t look like our usual ICU clientele of the cachectic elderly. These are mostly men (my imagination?) ranging from their 50-70s.
I made the mistake of asking who the youngest intubated COVID patient on the unit was.
Younger than me.
So we finish at the ED. It’s not chaotic like a Saturday night. Sure there are a few beds in the hallways, but that’s nothing new. I walked the length of it too. Some people on oxygen here and there, wider variety of ages.
Lots of people getting gowned up to enter rooms though. And I know we’re supposed to take them off at the door of the patient’s room, why are people walking around-
“HEY! If you’re going to stroll around here, you’re going to need full PPE. With an N95 on!”
The ED is now considered COVID home territory.
…
I don’t feel like a soldier. I don’t feel brave for showing up to my job. I most certainly don’t feel like a hero.
I feel like the tide came in way too fast and now I'm staring at waves from below.
​
​
Day 6
“There’s another Anesthesia Stat. Don’t know where we’re gonna put that one.”
55M with PMH of uncontrolled DM2, HTN, CKD3. Admitted 5 days ago for fever, SoB, dry cough, you get it. COVID positive on Day 1. Went to a COVID medsurg floor, experienced worsening hypoxia on NC, and started on nonrebreather. By Day 5, transferred to the newest territory grab of the Greater ICU, the Post-Anesthesia Care Unit - the PACU. We’re not doing surgeries anymore, so no anesthesia, so that’s free real estate to park the intubated.
One other thing. The PACU was never meant for anything longer than a few hours’ stay and has only drapes between beds. No doors or walls means this is COVID home turf. You have to completely PPE up to even enter the unit.
This newest long walk of ventilated COVID patients is kept alive by 2nd string equipment. No modern touch screens, no real time graphs, just an aged-beige box with some dials and digital-clock-red settings. It does the same job - you can set the PEEP, FiO2, RR, AC/PSV just as precisely as the modern machines.
Even the third tier stuff never intended to serve as ventilation for the 10-14 days of ventilation COVID patients may require works well. These are the surgical ventilators the anesthesiologists used to use back when we did surgeries. They have been liberated to serve the Greater ICU. We’ve even drafted the ad hoc ventilators of the local community of outpatient docs to act as reserves.
Code Blue called on the 55M gentleman above. The team rushes up and I am deeply relieved that it’s not a Code I have to run. By the time we get our PPE on (takes about 3 minutes), he’s already being intubated. No chest compressions required. We put in some orders, we watch the Veteran Attendings tube their first patient of the day. It is only about 8AM.
”Anesthesia Stat to the ED” heard on the overhead PA means someone is getting intubated essentially right after they enter the door. The Intensivist sighs and wonders out loud where they’re going to place this next patient on a vent.
The Greater ICU is quickly becoming The Empire of the ICU as more unused departments get swallowed up by the need to house the intubated.
...
I try to comfort myself with knowing I'm still living in the
good
days, relatively speaking.
No one on the hospital staff is sick. No one on my team or Residency program is sick. I'm not sick. We still have beds and ventilators, at least for the time being.
We've still got a week and a half for this to reach its peak.",
Medicine,https://old.reddit.com/r/medicine/comments/fkc9zf/im_a_physician_and_i_was_just_denied_covid19/,3384,588,I'm a physician and I was just denied COVID-19 testing because I don't have a history of travel or a direct contact with COVID-19 patient.,"You read it right.
We have multiple confirmed cases at my hospital already.
I have low grade fever, dry cough, malaise, stuffy nose, fatigue, headache.
Instead I was asked to stay home for 14 days because I don't meet the criteria for testing but I'm still symptomatic so I can't come to work.
Where are the tests we were promised this week?
How does any of this make any sense?",
Medicine,https://old.reddit.com/r/medicine/comments/ftam6g/3_more_days_of_inpatient_care_in_new_york/,3320,197,3 More Days of Inpatient Care in New York,"Day 8
“A beautiful day in hell”
​
The 88F who signed the DNI/DNR was transferred from our service to a sister service also staffed with Residents a few days ago. The hand over occurred for no reason other than she was roomed in a wing that the COVID team recently took over wholesale. My team is no longer in charge of her case. But I’ve been chart-stalking her vitals and prognosis regardless because she’s still my patient.
And the prognosis is not good. Even on a 100% nonrebreather, her sats are in the mid 80s. Without the DNI, she would have been on a ventilator a day or two ago. She’s tachypneic, taking a breath every other second or so. Palliative care has been consulted and she’s been placed on ever increasing amounts of morphine to help curb her air hunger. As of this afternoon, she’s been placed on a morphine drip. She’s still wide awake, but her prognosis is dire.
That’s a word we get to use in charts.
Dire
. Seems almost melodramatic.
I decide to use some of the free time I have on this puddle-grey afternoon to leave my call room bunker and go visit her. I make a brief stop to get an update from her new team. It’s as bad as I thought. I ask if she’s going to make it through the night. Probably. Maybe not tomorrow night though.
I put on the PPE including my shiny new and properly fitted N95 I picked up that morning, and enter the room. I make a point to avoid reading the Fox News's chyron on the room's TV. We make small talk about her lemon ice cup. She likes it, I tell her I like them too and have stolen a fair number of them from the floor’s patient fridge over the years.
She knows something is up. She asks why I’m checking in on her, and I can see her get a little out of breath taking the mask off for even a few seconds then saying one sentence. I say I don’t like the direction her oxygenation is going, and I’m concerned.
“So I’m losing my battle?”
Really starting to hate that metaphor.
""This comes as a surprise.""
She met with our Palliative care team 2 days prior and comfort care was started.
She asks flat out what her prognosis is.
Once again, because I am an idiot, I tell her the truth.
I say that she might be seeing the end of her life sooner rather than later. Maybe less than 1 week at the rate things are going. I avoid using the word
dire
. When she asks if she's dying, I say unfortunately, yes.
""So you transfer me to another doctor and I'm dying. Your team must feel like failures.""
Not a word of that is misquoted or taken out of context.
…
Spotted a new homemade sign right below the hospital's entrance marker as you drive in. Block letters on white plywood:
YOU ALL
R
HEROES
​
​
Day 9
“You want to push another epi?” “Sure, why not.”
​
Overhead on the hospital PA:
“As you know, today is National Doctor’s Day. Let’s conclude this quiet moment by standing where you are and applauding our heroic physicians.”
As that played, half a dozen nurses and I were frantically getting into our PPEs outside a suspected COVID room to rush into a Code Blue.
Surprisingly, no one stopped to applaud.
Inside, the calming voice was drowned out by the hiss of a nonrebreather, the labored expiratory moans of the patient, and the warning dings of the bedside monitor. The bedside monitor was not happy that the patient’s heart rate was somewhere in the high 160s and was letting the room know its opinion on the matter.
Narrow complex ventricular tachycardia. But the patient isn’t hypotensive or otherwise unstable. You don’t lay on the paddles of a defibrillator for that.
“You’re going to feel a little funny for a second,” is what the nurse says to reassure the patient. What she really meant was, “We’re going to stop your heart for a second or two to reset your circuit breaker, so if it feels like you’re dying briefly, it’s because you are.” The nurse draws up some adenosine, the other MD in the room slams the bolus into the patient’s veins, and everybody gets to watch the monitor flatline for a held breath before a heart rate returns. Takes two boluses for it to take.
Problem solved.
For 73 minutes.
Nothing was playing overhead for the second Code Blue. Thankfully, an intensivist was already inside running the show. I guess the Residents haven’t been left out to fend for ourselves yet. This time around the bedside monitor was simply furious that the patient stopped breathing.
Pulseless electrical activity, PEA. The heart’s wires are firing but the pump isn’t working. You don’t lay on the paddles of a defibrillator for that either.
Hollywood has lied to you your whole life.
“Do you think we’re going to be able to resuscitate him?” “He’s full Code.” “But do you think
we’re going to be able
to resuscitate him?” “No, but…” “Right, so it doesn’t matter. We’re running the Code.”
I get my exercise for the day by pressing on the patient’s chest for a couple minutes.
“I don’t really want to intubate him.” The patient gets intubated anyway.
The respiratory therapist on my right (I think it's the RT, at least, everyone looks the same unders layers of PPE) gets a small spray of pink frothy fluid on her gown. Thank Christ for PPE.
A few people cycle through pushing on the patient’s chest. We haven’t felt a pulse since the Code began.
“How long has it been?” I suspect there’s a countdown timer in the intensivist’s brain that’s ticking towards an alarm labeled
Ok, We Tried
.
More compressions. Pretty sure I feel a rib break under my palms.
That
sensation never ceases to make me wince.
Another epi. Still no pulse.
The Doppler to check for a pulse is silent.
The timer goes off.
“That’s it.”
Time of death called.
…
Feels like COVID is eroding the edges off everyone’s soul in the hospital.
The initial novelty of sharp fear and apprehension standing outside COVID rooms before entering is giving way to a constant background dull dread as we gown up for the tenth or twentieth time that day.
I see my incredibly sharp attending boss distracted, needing to be reminded two or three times whose room he’s about to enter.
The lack of success in curing our patients is also taking its toll. “Successes” have mostly been defined as sending a patient home with personal oxygen tanks and explicit instructions on when to return if they get worse. We’ve had some milder cases that got sent home without oxygen, but they seem fewer than the number we send to get tubed.
I feel very bitter about this. It makes the sign out front, a sign that expresses nothing but pure gratitude and love, seem somehow mocking.
​
​
Day 10
""How many for you?"" ""Two."" ""Of twelve? Not so bad.""
​
88F w/PMH of HTN, prediabetes, Afib (on Coumadin) presented w/ a 3 day hx of progressive SoB, cough and subjective fevers. Found to be COVID-19 positive. Hospital course significant for clinical deterioration during stay requiring supplemental O2 via NRB. Repeat CXR 3/29/20 showed interval development of diffuse increased interstitial markings concerning for multifocal B/L PNA. Pt started on comfort measures but was found to be…
…
Let’s start over.
There once was a woman who lived a really long time. Let’s call her Ethel; she looks like an Ethel.
Like any octogenarian, Ethel had a few health issues, for which she took exactly seven pills each morning. It sounds like she lived a full life. We only really know that she was a NON-SMOKER and LIVES AT HOME. No one wrote down anything more than that in the box that’s supposed to summarize Ethel’s social life. She had a husband who was her emergency contact. There’s no box to check if they loved one another, but it’s probably a given that this theoretical box would house a neat little checkmark inside. She had at least one daughter, whose name probably could be found in a chart under ""Most Favorite Person in the World.""
Unlike other octogenarians, Ethel never visited the hospital. She saw doctors, sure (that was the price of growing old) but as far back as the computer can look, there’s no record of her ever setting foot inside the Emergency Room, up until ten days ago at least.
Ten days ago she came to the hospital because it was getting harder to breathe. She also had a fever and her muscles were always sore, but it was the huffing and puffing that scared her enough to head in. She got some oxygen and was given a room inside the hospital all to herself. She got that room because she had COVID – that virus which was causing the whole world to go crazy and her neighborhood to shut down. But the nurses were kind and the food wasn’t so bad. The oxygen helped her breathe. She was getting those drugs the President said would cure COVID. She probably liked the President. She sure liked to watch the News on TV.
On her third day in the hospital, a doctor came by and explained that since she needs a mask to breathe, if things got worse, the next step would have to be putting her to sleep and hooking her up to machines to keep her alive. Ethel didn’t want that. But her Most Favorite Person in the World would want her to FIGHT, so she reluctantly said she would be ok with a plastic tube down her throat. But the doctor said that this was Ethel’s choice, not her daughter’s, and it was an important one. He left the room so she could decide what to do.
The form she signed was bright pink. It had boxes on it that housed neat little checkmarks next to DO NOT REVIVE and DO NOT INTUBATE.
Ethel continued to take her medications and continued to breathe with a mask. Sometimes the very nice nurses would tell her to lie on her belly because it would help her breathe better. It was getting harder to breathe, even with the mask. Ethel thought the medications were making it harder to breathe, but believed once she completed the five days, she would start feeling better and could go home.
Those five days came and went. She wasn’t feeling better and could not go home. Another doctor came by and explained that her specialty was helping people feel better towards the end of their lives (which was only a possibility in her case, not something written in stone.) Ethel liked the morphine this other doctor gave her because it made it easier to breathe. Ethel did not like the anxiety pills this other doctor gave her because they made her drowsy.
One day the same doctor she saw right before signing the bright pink form came to visit her again. He said she was going to die. Ethel was very angry at this because she thought she was doing better. She said some things which in the bigger scheme of things aren’t that important. But really she just wanted the doctor to call her family to tell them what was going on.
Ethel got more and more morphine. She kept asking for it so often that the nice nurses put a machine in her room that gave her morphine around the clock.
Ethel couldn’t or maybe didn’t want to answer the doctor’s questions anymore.
Ethel was very tired during the day, so she mostly slept.
Ethel went to sleep one afternoon and didn’t wake up.
…
…
227 of 257 patients in the hospital are COVID positive. 41 COVIDS on ventilators. The ICU has expanded to the Cath lab. 1N and 3N have fallen, they're both COVID units now. I don't know how many ventilators we have left.
The passing of ""Ethel"" today marks the first patient formerly under my team’s care to be killed by COVID.
It’s so much easier to write fiction than it is to write about how angry and sorry I feel.
I open up my email and the first one is titled ""Heroes."" Overhead PA propaganda announcements play
Here Comes the Sun
and say ""Not all superheros wear capes, some wear scrubs and gowns"" and I want to pound my desk and go for a walk anywhere outside of these walls without a goddamn mask on my face.
I don’t
want
to humanize my patients more by imagining their lives outside their rooms back when they were healthy.
I don’t
want
to do the hard, right thing and be honest and get hurt.
I don’t want to see my patients be put on ventilators and/or die.
But I will. I have to.",
