subreddit,permalink,score,num_comments,title,body_text,image_url
Medicine,https://old.reddit.com/r/medicine/comments/qzu1rc/a_detailed_description_of_how_you_die_from_covid/,8052,599,A detailed description of how you die from COVID in the ICU,"Good morning.
I squeeze your hand.
“It’s Friday at 9 o’clock in the morning.” I look out the window. “Gloomy day. It rained last night.”
You say nothing, because you’re chemically paralyzed and deeply sedated. All the drugs in the world to keep you from trying to breathe. My machine does it much better than you ever will.
I look over the fingers on your left hand. They’re falling off. You’re so sick that I was forced to choose your brain and your bowels to get blood instead of your fingers and toes.
Later that day, I take a long camera and put it down the tube breathing for you. I need to get some of the mucous in your lungs out. I quietly apologize for moving around your tube. It’s in your neck now, a surgically created hole, because the tube in your mouth caused your tongue to bleed. Your heart rate on the monitor shoots up. You’re paralyzed, but this is hurting you. I can tell by your heart rate. I ask your nurse for more medications to drip through your IVs. Please go back to sleep.
I watch your nurse troubleshoot your new kidneys. Except it’s a machine, your kidneys, because they stopped working from the weeks of toxins I gave you to try to keep you alive.
I’m not sure, but you probably don’t know who you are anymore. Your brain is so confused by the forced paralysis, the forced sleep, the inability to think, that you’ve become lost. Who are you?
Your family wants you to live, as every loved one wants for their person, so every day I watch your body die a little more. Every day I add a new medication to stave off the inevitable. A new side effect. You haven’t had a bowel movement in weeks. Your body is starving.
Eventually, your immune system and your body can’t fight off the bacteria living in your own body, your own skin, the normal things in the air. The bacteria take hold. They start using your blood to grow. They fill up your lungs with their damage. I add more medications.
I watch your last weeks alive. I watch your organs fail. I watch your fingers fall off. I watch your skin stop being able to protect your muscles and fat and just wear away in places. I watch your last few weeks alive, not knowing who you are, forcefully keeping you asleep. I hope you don’t feel this.
In 25 days, I will tell your family that despite every possible forceful thing I can do to keep you alive, your last little bit is now dying too. It might be your heart, starved for oxygen and trying so hard to keep up that it finally couldn’t squeeze any more. It might be your brain, where weeks of dying finally gave you a stroke.
If they’re kind, your family will tell me to keep you asleep and let you die. If they don’t believe me, I will spend my last moments with you watching someone crack every rib in your chest. A demand to your broken body that I can no longer demand. Stay alive.
I am angry for you. I am angry someone lied to you. I am angry that you were taken advantage of, for reasons I will never understand.
If you have not been vaccinated against COVID-19, this is how you die from it.
Please reconsider. You are wrong. Please give the small part of you that whispers, maybe I have been lied to, give it a chance.
Do not die like this.
-a tired ICU fellow.",
Medicine,https://old.reddit.com/r/medicine/comments/fp24qc/3_days_of_inpatient_care_in_new_york/,4956,356,3 Days of Inpatient Care in New York,,
Medicine,https://old.reddit.com/r/medicine/comments/kb3fth/help_a_doctor_in_my_hometown_was_kidnapped_by_the/,4808,132,Help! A doctor in my hometown was kidnapped by the police and tortured.,,
Medicine,https://old.reddit.com/r/medicine/comments/rqxu9t/powerless_rant/,4614,405,Powerless [Rant],,
Medicine,https://old.reddit.com/r/medicine/comments/fnz2a3/dr_usama_riaz_has_spent_weeks_screening_treating/,4421,335,"Dr. Usama Riaz has spent weeks screening, treating coronavirus patients even then he knew PPE was not available. He lost his battle today. Remember his name. He was 26.",,
Medicine,https://old.reddit.com/r/medicine/comments/flk0e3/there_is_no_emergency_in_a_pandemic/,4397,397,There is no emergency in a pandemic,,
Medicine,https://old.reddit.com/r/medicine/comments/1mdrtbb/today_i_was_a_hero/,4331,156,"Today, I was a hero","A family came in with their 2mo.  And they were very hesitant about vaccines.  ""Which ones are really important?""
So I went through each disease for which the child would be vaccinated today.
I told them about diphtheria and the 30% mortality rate, how diphtheria toxin is one of the most toxic substances known, as a single molecule can kill a cell.  I told them about how this disease use to terrify communities.
They'd already heard of tetanus.  Everyone has heard of tetanus.
I told them about pertussis and the baby I saw who coughed and coughed and coughed and coughed and coughed...until he went into laryngospasm.  We did everything we could.  I will never forget his mother throwing herself at our feet begging us to not say what we were going to say.  I let that family see the tears playing in my eyes as I described the memory.  They needed to know that I am doing this
because I fucking care.
Not because of some quality metric.
We'd already discussed how hepatitis B is spread by nonsexual transmission and how in the prevaccine era, as many as 65% of infants born to HBV positive
fathers
had HBV by the tme they were a year old.  We talked about how that is a life sentence before age 1.
They know about polio.
I talked about the baby I watched die of pneumococcal sepsis.  Another mother at our feet.  Another family destroyed by a microbe.
I described a cricoidotomy in graphic detail.
I was admitted for rotavirus in February of 1979.  I still have the hospital bill for $20.  My mother told me about how sick I was.  And 25 years later, I became a resident and I saw babies with rotavirus.  You could hear the diarrhea from across the emergency department.  We had to do our own IVs at the NYC hospital.  The babies were just so sick and all we could do was keep them hydrated and wait for them to recover.  And then in the fall of 2006 the rotavirus vaccine came out.  And in February of 2008 I was the senior on the floor and... there weren't any rotavirus kids.  It was just gone.
And I asked that mother, now that she'd asked me which vaccines were important, I was going to turn the questions around.  Which ones did
she
think were important?
That baby got every recommended immunization today.   I won.  RFJ Jr. lost.  The parents won; that mother won't be throwing herself at my feet.
Most importantly, the baby won.
-PGY-21",
Medicine,https://old.reddit.com/r/medicine/comments/j7232h/my_residency_program_thinks_very_highly_of_me_as/,4289,136,My residency program thinks very highly of me as an individual,,https://i.redd.it/8o7uo43mdrr51.jpg
Medicine,https://old.reddit.com/r/medicine/comments/ff8hns/testimony_of_a_surgeon_working_in_bergamo_in_the/,4163,510,"Testimony of a surgeon working in Bergamo, in the heart of Italy's coronavirus outbreak","«In one of the non-stop e-mails that I receive from my hospital administration on a more than daily basis, there was a paragraph on ""how to be responsible on social media"", with some recommendations that we all can agree on. After thinking for a long time if and what to write about what's happening here, I felt that silence was not responsible. I will therefore try to convey to lay-people, those who are more distant from our reality, what we are experiencing in Bergamo during these Covid-19 pandemic days. I understand the need not to panic, but when the message of the danger of what is happening is not out, and I still see people ignoring the recommendations and people who gather together complaining that they cannot go to the gym or play soccer tournaments, I shiver. I also understand the economic damage and I am also worried about that. After this epidemic, it will be hard to start over.
Still, beside the fact that we are also devastating our national health system from an economic point of view, I want to point out that the public health damage that is going to invest the country is more important and I find it nothing short of ""chilling"" that new quarantine areas requested by the Region has not yet been established for the municipalities of Alzano Lombardo and Nembro (I would like to clarify that this is purely personal opinion). I myself looked with some amazement at the reorganization of the entire hospital in the previous week, when our current enemy was still in the shadows: the wards slowly ""emptied"", elective activities interrupted, intensive care unit freed to create as many beds as possible. Containers arriving in front of the emergency room to create diversified routes and avoid infections. All this rapid transformation brought in the hallways of the hospital an atmosphere of surreal silence and emptiness that we did not understand, waiting for a war that had yet to begin and that many (including me) were not so sure would never come with such ferocity (I open a parenthesis: all this was done in the shadows, and without publicity, while several newspapers had the courage to say that private health care was not doing anything).
I still remember my night shift a week ago spent without any rest, waiting for a call from the microbiology department. I was waiting for the results of a swab taken from the first suspect case in our hospital, thinking about what consequences it would have for us and the hospital. If I think about it, my agitation for one possible case seems almost ridiculous and unjustified, now that I have seen what is happening. Well, the situation is now nothing short of dramatic. No other words come to mind. The war has literally exploded and battles are uninterrupted day and night. One after the other, these unfortunate people come to the emergency room. They have far from the complications of a flu. Let's stop saying it's a bad flu. In my two years working in Bergamo, I have learned that the people here do not come to the emergency room for no reason. They did well this time too. They followed all the recommendations given: a week or ten days at home with a fever without going out to prevent contagion, but now they can't take it anymore. They don't breathe enough, they need oxygen. Drug therapies for this virus are few.
The course mainly depends on our organism. We can only support it when it can't take it anymore. It is mainly hoped that our body will eradicate the virus on its own, let's face it. Antiviral therapies are experimental on this virus and we learn its behavior day after day. Staying at home until the symptoms worsen does not change the prognosis of the disease. Now, however, that need for beds in all its drama has arrived. One after another, the departments that had been emptied are filling up at an impressive rate. The display boards with the names of the sicks, of different colors depending on the department they belong to, are now all red and instead of the surgical procedure, there is the diagnosis, which is always the same: bilateral interstitial pneumonia. Now, tell me which flu virus causes such a rapid tragedy.
Because that's the difference (now I get a little technical): in classical flu, besides that it infects much less population over several months, cases are complicated less frequently: only when the virus has destroyed the protective barriers of our airways and as such it allows bacteria (which normally resident in the upper airways) to invade the bronchi and lungs, causing a more serious disease. Covid 19 causes a banal flu in many young people, but in many elderly people (and not only) a real SARS because it invades the alveoli of the lungs directly, and it infects them making them unable to perform their function. The resulting respiratory failure is often serious and after a few days of hospitalization, the simple oxygen that can be administered in a ward may not be enough. Sorry, but to me, as a doctor, it's not reassuring that the most serious are mainly elderly people with other pathologies. The elderly population is the most represented in our country and it is difficult to find someone who, above 65 years of age, does not take at least a pill for high blood pressure or diabetes.
I can also assure you that when you see young people who end up intubated in the ICU, pronated or worse, in ECMO (a machine for the worst cases, which extracts the blood, re-oxygenates it and returns it to the body, waiting for the lungs to hopefully heal), all this confidence for your young age goes away. And while there are still people on social media who boast of not being afraid by ignoring the recommendations, protesting that their normal lifestyle habits have ""temporarily"" halted, the epidemiological disaster is taking place. And there are no more surgeons, urologists, orthopedists, we are only doctors who suddenly become part of a single team to face this tsunami that has overwhelmed us.
The cases multiply, up to a rate of 15-20 hospitalizations a day all for the same reason. The results of the swabs now come one after the other: positive, positive, positive. Suddenly the emergency room is collapsing. Emergency provisions are issued: help is needed in the emergency room. A quick meeting to learn how the to use to emergency room EHR and a few minutes later I'm already downstairs, next to the warriors on the war front. The screen of the PC with the chief complaint is always the same: fever and respiratory difficulty, fever and cough, respiratory insufficiency etc ... Exams, radiology always with the same sentence: bilateral interstitial pneumonia. All needs to be hospitalized. Some already needs to be intubated, and goes to the ICU. For others, however, it is late. ICU is full, and when ICUs are full, more are created. Each ventilator is like gold: those in the operating rooms that have now suspended their non-urgent activity are used and the OR become a an ICU that did not exist before. I found it amazing, or at least I can speak for Humanitas Gavazzeni (where I work), how it was possible to put in place in such a short time a deployment and a reorganization of resources so finely designed to prepare for a disaster of this magnitude. And every reorganization of beds, wards, staff, work shifts and tasks is constantly reviewed day after day to try to give everything and even more. Those wards that previously looked like ghosts are now saturated, ready to try to give their best for the sick, but exhausted. The staff is exhausted. I saw fatigue on faces that didn't know what it was despite the already grueling workloads they had. I have seen people still stop beyond the times they used to stop already, for overtime that was now habitual. I saw solidarity from all of us, who never failed to go to our internist colleagues to ask ""what can I do for you now?"" or ""leave that admission to me, i will take care of it."" Doctors who move beds and transfer patients, who administer therapies instead of nurses. Nurses with tears in their eyes because we are unable to save everyone and the vital signs of several patients at the same time reveal an already marked destiny. There are no more shifts, schedules.
Social life is suspended for us. I have been separated for a few months, and I assure you that I have always done my best to constantly see my son even on the day after a night shift, without sleeping and postponing sleep until when I am without him, but for almost 2 weeks I have voluntarily not seen neither my son nor my family members for fear of infecting them and in turn infecting an elderly grandmother or relatives with other health problems. I'm happy with some photos of my son that I look at between tears and a few video calls. So you should be patient too, you can't go to the theater, museums or gym. Try to have mercy on that myriad of older people you could exterminate. It is not your fault, I know, but of those who put it in your head that you are exaggerating and even this testimony may seem just an exaggeration for those who are far from the epidemic, but please, listen to us, try to leave the house only to indispensable things. Do not go en masse to make stocks in supermarkets: it is the worst thing because you concentrate and the risk of contacts with infected people who do not know they are infected. You can go there without a rush. Maybe if you have a normal mask (even those that are used to do certain manual work), put it on. Don't look for ffp2 or ffp3. Those should serve us and we are beginning to struggle to find them. By now we have had to optimize their use only in certain circumstances, as the WHO recently recommended in view of their almost ubiquitous running low. Oh yes, thanks to the shortage of certain protection devices, many colleagues and I are certainly exposed despite all the other means of protection we have. Some of us have already become infected despite the protocols. Some infected colleagues also have infected relatives and some of their family members are already struggling between life and death. We are where your fears could make you stay away. Try to make sure you stay away.
Tell your family members who are elderly or with other illnesses to stay indoors. Bring him the groceries please. We have no alternative. It's our job. Indeed what I do these days is not really the job I'm used to, but I do it anyway and I will like it as long as it responds to the same principles: try to make some sick people feel better and heal, or even just alleviate the suffering and the pain to those who unfortunately cannot heal. I don't spend a lot of words about the people who define us heroes these days and who until yesterday were ready to insult and report us. Both will return to insult and report as soon as everything is over. People forget everything quickly. And we're not even heroes these days. It's our job. We risked something bad every day before: when we put our hands in a belly full of someone's blood we don't even know if they have HIV or hepatitis C; when we do it even though we know they have HIV or hepatitis C; when we stick ourselves during an operation on a patient with HIV and take the drugs that make us vomit all day long for a month. When we read with anguish the results of the blood tests after an accidental needlestick, hoping not to be infected. We simply earn our living with something that gives us emotions. It doesn't matter if they are beautiful or ugly, we just take them home. In the end we only try to make ourselves useful for everyone. Now try to do it too, though: with our actions we influence the life and death of a few dozen people. You with yours, many more. Please share and share the message. We need to spread the word to prevent what is happening here from happening all over Italy.»
Sources:
Original Facebook post
Italian newspaper (Corriere della Sera, edizione di Bergamo) transcript
EDIT: updated sources with original FB post",
Medicine,https://old.reddit.com/r/medicine/comments/f7tqtk/scrubbing_into_a_cabg_with_your_mom_as_your/,4137,247,Scrubbing into a CABG with your mom as your attending,,https://i.imgur.com/OI6QV37.jpg
Medicine,https://old.reddit.com/r/medicine/comments/4g8pf8/he_is_small_for_an_eightyearold_boy_made_even/,4088,624,"He is small for an eight-year-old boy, made even smaller by the big trauma room gurney beneath him...","He is small for an eight-year-old boy, made even smaller by the big trauma room gurney beneath him. Two skinny, sunburnt legs stick out from a pair of much too large, frayed, hand-me-down cutoffs. Green grass stains cover the skin of both knees. His bare feet are filthy, farm boy filthy. The kind of filthy that comes from playing in the cool dirt of an old barn floor, from running through uncut fields of wheat alongside the combines, and from climbing the giant hay bales that dot the rolling hills this time of year.
Two hours ago he was just another shirtless boy in a cowboy hat playing in the wheat.
His mother stands across from me. She is perhaps thirty-two. She has sandy blonde hair, just like the boy on the gurney. I can’t see her face because it is buried in her husband’s chest. She is completely silent but her whole body shakes, trembling like an old John Deere combine with something stuck in its blades. Her husband pulls her tight, his arms wrapping around her, trying to protect her from this place, this moment.
The two of them clutch to each other, here, in my emergency room.
At the head of the bed the ventilator chimes and puffs and clicks along as it pushes air into the boy. It pushes air into lungs that collapsed and now have chest tubes draining them. Lungs that cried out just loud enough to stop thirty thousand pounds of combine from turning the boy into chaff with the wheat.
The boy’s arm twitches. The nurse next to me blinks back tears and adjusts his IV.
A case like this is a bomb that detonates in our ER, in our town, in our lives. The shockwaves right now are spreading as neighbors call neighbors, as friends call friends, as family reaches out for family and parents run to check on their children. I know I will not be the only one unable to sleep tonight.
The father stares at his son on the gurney. His face is filled with questions for which I have no answers. How can this happen? How can something we love, something so full of life, be so fragile, so vulnerable, so easily cut down and taken from us in the blink of an eye?
He does not know it yet but he is now standing in a new life. A life that will always be different from the one he woke up to this morning.
I step over to the computer to order some more sedation for the boy while we wait for the helicopter. Taped above the screen is a brand new sign. It is a decal of five gold stars. It seems so out of place at a moment like this. The last few weeks the hospital has been putting them up everywhere. They are there to remind us to give ‘five-star’ service- to tell our patients how much we appreciate their business and hope they will choose us for their future healthcare needs.
They are to be called customers now, not patients, we are told.
Customers.
I tear it off the screen and wrinkle it in my hand into a ball, squeezing it tight. I shove it in the pocket of my white coat.
Twenty-two minutes later the whine of the helicopter engine fills the air as it prepares for takeoff. I stand outside with the father, watching the big blades spin up to speed in the late August light. Inside the helicopter there is room enough for only one parent to go with the boy. One hundred and three miles away a pediatric ICU bed is waiting.
The helicopter lifts off and a cloud of late summer dust fills the air. The father does not move as the debris cloud swirls about his head. Instead, he stares at the window on the side of the helicopter, the dark outline of his son just visible to us both.
We watch the helicopter rise above the pad and rotate slowly. It climbs a little further, hesitates in the air, and then races off above the wheat fields, the grains below bowing from the thrust of its blades.
I take out the five-star decal from my pocket, unfolding it carefully. I tear it in two and press the larger half against the brick wall behind us. I scribble my home phone number on the back.
“Let me know,” I say.
The father takes the paper and nods, still staring at the shrinking outline of the helicopter. At last it disappears over the mountains in the distance. He turns to me but his eyes are empty now. He is already departing, already arriving at the next place. We shake hands and he walks slowly off to his truck. He’s got a long, quiet drive to the city ahead of him.
I look down at what’s left of the ripped up decal in my hand.
The image of the boy burns bright in my mind. I know I will carry this day with me for a very long time.
I make a fist, crumpling the decal.
I respectfully disagree with those who want us to call them customers, healthcare consumers, or business opportunities.
The people we care for are sons and daughters. Mothers and fathers. Husbands and wives. They are neighbors, friends, and sometimes even colleagues.
They are people like you and me in a moment of need.
They are patients.
Addendum:
When I wrote this I thought maybe a couple dozen people would want to discuss it. I had no idea it would blow up like this. A couple short points:
I really appreciate everyone's comments and insights- from the administrators, to the patients, to others in healthcare. I have learned a great deal just from reading your posts and I hope others have too. Those of you who share your insights and experiences with others are truly the best of reddit.
To those determined to find and dox the boy in the story I say this: You are welcome to keep trying but you won't find him. Out of respect for my patients and because of HIPAA I always change enough details of anything I write in a way that makes it impossible to find the individual while staying true to what happened. I will say the original patient who inspired this story several years ago ended up fine.
To those of you who asked if I have written anything else I wrote a book of short stories about being an ER doc in a small town. It's here if you are interested.
http://goo.gl/7mzn2P
Thanks again for reading and for everyone's input.",
Medicine,https://old.reddit.com/r/medicine/comments/g7y3xc/this_man_has_definitely_had_a_huge_impact_on_your/,4057,73,"This man has definitely had a huge impact on your practice. Rest in peace Dr. Burton Rose, the founder of UpToDate. Another victim of Covid-19",,
