subreddit,permalink,score,num_comments,title,body_text,image_url
GodofWar,https://old.reddit.com/r/GodofWar/comments/iueovc/me_when_i_saw_the_ragnarok_teaser_at_the_end_of/,6128,121,Me when I saw the Ragnarok teaser at the end of the PS5 showcase,,https://i.redd.it/i8t57ubptnn51.jpg
GodofWar,https://old.reddit.com/r/GodofWar/comments/kfvw01/i_found_this_on_facebook/,6111,140,i found this on facebook,,
GodofWar,https://old.reddit.com/r/GodofWar/comments/d012tr/im_sure_this_has_been_posted_before_but_its/,6091,62,"I’m sure this has been posted before, but it’s amazing",,
GodofWar,https://old.reddit.com/r/GodofWar/comments/zaspos/rage_of_sparta_theme_boy_shield_your_eyes_im/,6089,409,"(Rage of sparta theme) BOY , shield your eyes! im gonna do something unwise!",,https://i.redd.it/oiakmj2uek3a1.jpg
GodofWar,https://old.reddit.com/r/GodofWar/comments/1iby5u7/most_hyped_scene_in_the_game/,6062,79,Most hyped scene in the game,,
