subreddit,permalink,score,num_comments,title,body_text,image_url
GodofWar,https://old.reddit.com/r/GodofWar/comments/plnwtk/angrboda_be_exposing_a_lot_of_fools_on_social/,33726,5866,Angrboda be exposing a lot of fools on social media right now,,https://i.redd.it/p9tvbtc48pm71.png
GodofWar,https://old.reddit.com/r/GodofWar/comments/rhrlh8/a_gift_from_my_gf/,22354,435,A gift from my gf,,
GodofWar,https://old.reddit.com/r/GodofWar/comments/k6gpr8/ii_dont_think_theres_a_word_that_exist_that/,18251,1199,I....I don't think there's a word that exist that conveys my feelings about this development.......,,
GodofWar,https://old.reddit.com/r/GodofWar/comments/k9utat/this_path_you_walkvengeance_you_will_find_no/,15271,303,"""This path you walk...vengeance. You will find no peace. I know"".",,https://i.redd.it/1a53v20vs6461.jpg
GodofWar,https://old.reddit.com/r/GodofWar/comments/1jly86t/the_artwork_i_been_waiting_for/,14924,63,The artwork I been waiting for🔥🔥,,https://i.redd.it/wi3p10cacgre1.jpeg
GodofWar,https://old.reddit.com/r/GodofWar/comments/pl7tyd/ragnarok_is_nearly_upon_us/,14798,1295,Ragnarok is nearly upon us 🤘,,"['https://preview.redd.it/9em1729lwjm71.png?width=108&crop=smart&auto=webp&s=a30846a81e18dde32378916b08b160187bc967b7', 'https://preview.redd.it/a7irv19mwjm71.png?width=108&crop=smart&auto=webp&s=7f0abeaf1099ecb8e3d80429fd47caef6fd65352', 'https://preview.redd.it/0uqy3jfowjm71.png?width=108&crop=smart&auto=webp&s=f6535723a2e0cabe2f15bcff7608862ba49342df', 'https://preview.redd.it/z7a7m6gqwjm71.png?width=108&crop=smart&auto=webp&s=a908032c0f0cee58c34bd9751148135b1290734b', 'https://preview.redd.it/6jll028rwjm71.png?width=108&crop=smart&auto=webp&s=84d222221d8913778ac34a8783eef7e4c1d6daf6', 'https://preview.redd.it/241agkeswjm71.png?width=108&crop=smart&auto=webp&s=64b783972b2ad817f79a1e48f03db76361a05ff3', 'https://preview.redd.it/nhi74n5twjm71.png?width=108&crop=smart&auto=webp&s=b114f9f21a738726d0991da834fe558445e1d7af', 'https://preview.redd.it/rn6djo2uwjm71.png?width=108&crop=smart&auto=webp&s=3afea62fcabc5fa0cecbf2e31eb0fb5cae3c3198', 'https://preview.redd.it/mjzs3rluwjm71.png?width=108&crop=smart&auto=webp&s=296c2105b6c8efa3ce8d5d7b23d9e30d6bcf1c49', 'https://preview.redd.it/x8v088uuwjm71.png?width=108&crop=smart&auto=webp&s=55d85c1c1fc028ca0abf8c8847ccdd0a80dc7ab8']"
GodofWar,https://old.reddit.com/r/GodofWar/comments/j3gxs8/half_naked_women_get_thousands_of_upvotes_how/,14035,103,Half naked women get thousands of upvotes; how many for our boy in blue?,,https://i.redd.it/tfjwi9b6pjq51.jpg
GodofWar,https://old.reddit.com/r/GodofWar/comments/hbd9tn/waiting_to_hear_the_end_of_mimirs_story_be_like/,13638,71,Waiting to hear the end of Mimirs story be like,,https://i.redd.it/s6oei480sn551.gif
GodofWar,https://old.reddit.com/r/GodofWar/comments/pm4swf/i_blame_the_mcu_for_making_people_believe_every/,13415,1031,I blame the mcu for making people believe every Thor depiction should look like Chris Hemsworth,,https://i.redd.it/2l8qe9mimum71.jpg
GodofWar,https://old.reddit.com/r/GodofWar/comments/og48ee/perfect_timing_sunhilegend_on_twitter/,13352,70,Perfect timing! (@SunhiLegend on Twitter),,
GodofWar,https://old.reddit.com/r/GodofWar/comments/1ioe73l/the_best_cosplay_doesnt_exi/,12659,129,The best cosplay doesn't exi-,,
GodofWar,https://old.reddit.com/r/GodofWar/comments/1jilr1d/gentlemen_its_been_an_honor/,11930,82,"Gentlemen, it’s been an honor.",,https://i.redd.it/2zhtb1b8jlqe1.jpeg
GodofWar,https://old.reddit.com/r/GodofWar/comments/q8qzsy/people_forget_that_sindri_was_about_to_throw/,11786,253,people forget that Sindri was about to throw hands with kratos until atreus stepped in lmao,,https://i.redd.it/hq4r3pbvvmt71.jpg
GodofWar,https://old.reddit.com/r/GodofWar/comments/1i8z6k8/low_effort_meme/,11746,125,Low effort meme,Leaf me alone Mimir,https://i.redd.it/dq4i4m07wyee1.jpeg
GodofWar,https://old.reddit.com/r/GodofWar/comments/zgieq8/christopher_judge_best_preformance_for_god_of_war/,11652,313,Christopher Judge best preformance for god of war ragnorak!!,,https://i.redd.it/8ntmvqf3wr4a1.png
GodofWar,https://old.reddit.com/r/GodofWar/comments/jmmdko/not_sure_if_im_ready_for_that/,11482,675,Not sure if I'm ready for that,,https://i.redd.it/0sfzq4jsjtw51.jpg
GodofWar,https://old.reddit.com/r/GodofWar/comments/prw8ve/theres_just_no_pleasing_some_people/,11374,514,There's just no pleasing some people,,https://i.redd.it/t0674dlw6oo71.png
GodofWar,https://old.reddit.com/r/GodofWar/comments/fduzc7/baldut_easter_egg_discovered_by_manfightdragon/,10940,140,Baldut Easter Egg discovered by @manfightdragon,,
GodofWar,https://old.reddit.com/r/GodofWar/comments/kkiiei/i_cant_feel_any_of_this/,10925,28,"""I can't feel ANY of this!""",,https://i.redd.it/wm5ye8x38j761.gif
GodofWar,https://old.reddit.com/r/GodofWar/comments/q7ag1k/a_man_of_sheer_will/,10676,89,A man of sheer will.,,https://i.redd.it/gnb3mg05s7t71.jpg
GodofWar,https://old.reddit.com/r/GodofWar/comments/ldvl3h/valkyries_video/,10628,151,Valkyries [Video],,
GodofWar,https://old.reddit.com/r/GodofWar/comments/1lbk60g/i_met_kratos/,10396,172,I met Kratos.,Such a calm and cool guy and awesome interaction overall. Made me want to play the games again lol.,"['https://preview.redd.it/vq9gq544sy6f1.jpg?width=108&crop=smart&auto=webp&s=51484ac074fd5e221b65dd1c9f1a29f312ca1220', 'https://preview.redd.it/iwwlm744sy6f1.jpg?width=108&crop=smart&auto=webp&s=17e2df58cb2f5a06b4bbcaed740b55dde24ea82f', 'https://preview.redd.it/p7ziqx34sy6f1.jpg?width=108&crop=smart&auto=webp&s=490c5765e0847e08ee4c60cda98463f39b6a324d', 'https://preview.redd.it/qvltra44sy6f1.jpg?width=108&crop=smart&auto=webp&s=ece1127477ad338ff8b99e969ba1b54cb47ebea6', 'https://preview.redd.it/cmt0l544sy6f1.jpg?width=108&crop=smart&auto=webp&s=c4245827a06570007c3951b278f60f1e49861f61']"
GodofWar,https://old.reddit.com/r/GodofWar/comments/lbohlv/right_who_would_do_such_a_thing/,10364,64,Right? Who would do such a thing,,https://i.redd.it/uxa789jeu9f61.jpg
GodofWar,https://old.reddit.com/r/GodofWar/comments/z1vlhs/anyone_else_relate/,10221,334,Anyone else relate?,,https://i.redd.it/eb7apu055k1a1.jpg
GodofWar,https://old.reddit.com/r/GodofWar/comments/1pijo1s/guillermo_del_toro_calls_the_god_of_war_games/,9965,220,"Guillermo del Toro Calls the 'God of War' Games ""Some of the Best Cinematic Experiences I've Ever Had""",Source,https://i.redd.it/l61iy5jou86g1.jpeg
GodofWar,https://old.reddit.com/r/GodofWar/comments/x98e0d/_/,9863,203,💀,,https://i.redd.it/bjtc7nxckom91.jpg
GodofWar,https://old.reddit.com/r/GodofWar/comments/zmxwsc/new_art_from_santa_monica_studio/,9860,285,New art from Santa Monica Studio,,https://i.redd.it/nn2nak24h66a1.jpg
GodofWar,https://old.reddit.com/r/GodofWar/comments/1j1bk0j/almost_got_it/,9598,36,Almost got it,,https://i.redd.it/exka5lg9m5me1.jpeg
GodofWar,https://old.reddit.com/r/GodofWar/comments/hhwrti/kratos_is_the_best_video_game_character/,9337,209,kratos is the best video game character,,https://i.redd.it/u38ouufoit751.jpg
GodofWar,https://old.reddit.com/r/GodofWar/comments/s12adq/his_strength_seems_highly_variable/,9257,243,His strength seems highly variable,,https://i.redd.it/uhe3jn3u3za81.jpg
GodofWar,https://old.reddit.com/r/GodofWar/comments/ppc7b0/but_i_wanted_a_trilogy/,9193,845,But i wanted a trilogy :(,,https://i.redd.it/dvzjdkzzxun71.png
GodofWar,https://old.reddit.com/r/GodofWar/comments/j1yqiq/the_god_slayer/,9154,89,The God Slayer,,https://i.redd.it/si1zaeok43q51.jpg
GodofWar,https://old.reddit.com/r/GodofWar/comments/j4um80/cursed_kratos/,9136,199,Cursed Kratos,,https://i.redd.it/ix6tq802z0r51.jpg
GodofWar,https://old.reddit.com/r/GodofWar/comments/1jhn2v9/a_calm_reasonable_person_meeting_a_ghost_of_sparta/,9063,160,A Calm Reasonable person meeting a Ghost of Sparta! 🤝🏻,,https://i.redd.it/knnpcffh4cqe1.jpeg
GodofWar,https://old.reddit.com/r/GodofWar/comments/lqhew5/most_baddass_raven_axe_throw_ever/,9028,100,Most Baddass Raven Axe Throw Ever?,,
GodofWar,https://old.reddit.com/r/GodofWar/comments/vspj0h/god_of_war_ragnarök_launches_on_ps4_ps5_november/,8960,683,"God of War Ragnarök launches on PS4 & PS5 November 9, 2022.",,https://i.redd.it/97t9uf5u4y991.jpg
GodofWar,https://old.reddit.com/r/GodofWar/comments/psrwwe/belts_of_chaos/,8871,164,BELTS OF CHAOS,,
GodofWar,https://old.reddit.com/r/GodofWar/comments/kcdfiw/everyone_talking_about_cyberpunk_and_im_just/,8613,187,Everyone talking about cyberpunk and I’m just sitting here like...,,https://i.redd.it/uwgjwqfgdz461.jpg
GodofWar,https://old.reddit.com/r/GodofWar/comments/1geeko6/meme/,8501,94,Meme,When you forget to recall the axe after a while 🤣,https://i.redd.it/lctgngdblkxd1.jpeg
GodofWar,https://old.reddit.com/r/GodofWar/comments/jble2w/i_dont_know_if_this_is_done_already/,8420,29,i don't know if this is done already,,https://i.redd.it/7ep3lyagp8t51.png
GodofWar,https://old.reddit.com/r/GodofWar/comments/mf5zwc/foolish/,8301,28,foolish,,https://i.redd.it/2n4ewewq4tp61.png
GodofWar,https://old.reddit.com/r/GodofWar/comments/jyhkwj/wait_what/,8232,123,wait WHAT,,https://i.redd.it/ggzgh7g3hn061.jpg
GodofWar,https://old.reddit.com/r/GodofWar/comments/pl6c9x/god_of_war_5_ragnarok_trailer_ps5_2022_hd/,8221,1354,GOD OF WAR 5 RAGNAROK Trailer PS5 (2022) HD,,
GodofWar,https://old.reddit.com/r/GodofWar/comments/8n6htl/i_translated_the_runes_on_the_cover_face_of/,8184,111,I translated the runes on the cover face of Collector Edition Box.,,https://i.redd.it/hdw59ffoxx011.jpg
GodofWar,https://old.reddit.com/r/GodofWar/comments/ixmk3u/kratos_reaction_to_picking_lambs_cress_from_the/,8059,85,Kratos' reaction to picking lambs cress (from the Raising Kratos documentary),,
GodofWar,https://old.reddit.com/r/GodofWar/comments/q2jpgz/the_motion_capture_actor_for_kratos_died_last_year/,8044,213,The motion capture actor for kratos died last year,,https://i.redd.it/2rqaf5r4ttr71.jpg
GodofWar,https://old.reddit.com/r/GodofWar/comments/n67nwy/i_made_another_one_with_this_format/,7999,61,I made another one with this format,,https://i.redd.it/chc38jvh8ix61.png
GodofWar,https://old.reddit.com/r/GodofWar/comments/1laujfs/lore_got_hella_dark_quick_lol/,7857,105,Lore got hella dark quick lol.,,https://i.redd.it/ovgy7kuz5s6f1.jpeg
GodofWar,https://old.reddit.com/r/GodofWar/comments/13b4g8n/_/,7827,161,🏃🏾🏃🏾🏃🏾,,
GodofWar,https://old.reddit.com/r/GodofWar/comments/1hlx06f/10_hours_in_how_much_longer_till_i_get_the_axe_or/,7820,100,10 hours in. How much longer till i get the axe or the blades of chaos?,,https://i.redd.it/z6vc6rtjiy8e1.jpeg
GodofWar,https://old.reddit.com/r/GodofWar/comments/xxxqml/me_on_nov_9th/,7616,181,Me on Nov 9th,,https://i.redd.it/j9qyw8eomds91.jpg
GodofWar,https://old.reddit.com/r/GodofWar/comments/webc4n/why_is_this_so_funny_and_accurate_at_the_same_time/,7464,139,Why is this so funny and accurate at the same time,,https://i.redd.it/dm65d5o3vaf91.jpg
GodofWar,https://old.reddit.com/r/GodofWar/comments/1937uh2/freya_cosplay_by_me/,7452,370,Freya cosplay by me,"Photo
https://www.instagram.com/morpheevaphotography","['https://preview.redd.it/9hau3mk23mbc1.jpg?width=108&crop=smart&auto=webp&s=2d7cf9780f5cacdddaa7ffb2919bfe1b530db509', 'https://preview.redd.it/enjx5rk23mbc1.jpg?width=108&crop=smart&auto=webp&s=9b92457088adc94b05f4768e1d813a42490439ea', 'https://preview.redd.it/p90r8sk23mbc1.jpg?width=108&crop=smart&auto=webp&s=42c6fe82f76dcbcf9ea42ae5051e5cede945c8dd', 'https://preview.redd.it/rvdwatk23mbc1.jpg?width=108&crop=smart&auto=webp&s=c4ecbab84dc9421b9dedb0699937e8f35501d819', 'https://preview.redd.it/9ab21uk23mbc1.jpg?width=108&crop=smart&auto=webp&s=7d8acc01b5e25ecc168d3b4a75d0b584e9a4cf92', 'https://preview.redd.it/hq2h4uk23mbc1.jpg?width=108&crop=smart&auto=webp&s=c4506136fe8dd40384cdc6b72c5ed08ad1412d6b', 'https://preview.redd.it/jnzh1tk23mbc1.jpg?width=108&crop=smart&auto=webp&s=8ff525c7bf9c784558aba417c2ebf17ef5db645a', 'https://preview.redd.it/qq8j1tk23mbc1.jpg?width=108&crop=smart&auto=webp&s=f8f1b3e9272f313c62c679ab7561bcd13e6c8383']"
GodofWar,https://old.reddit.com/r/GodofWar/comments/12cpb2f/they_freaking_did_it/,7366,306,They freaking did it!!!,,https://i.redd.it/2o4vrv04t4sa1.jpg
GodofWar,https://old.reddit.com/r/GodofWar/comments/k4l0fm/my_man_hades_just_vibing_in_the_underworld/,7378,108,My man hades just vibing in the underworld,,https://i.redd.it/d57s0ai5xk261.jpg
GodofWar,https://old.reddit.com/r/GodofWar/comments/kv7lra/many_controllers_were_sacrificed_along_the_way/,7326,126,Many controllers were sacrificed along the way,,https://i.redd.it/imh8nma7pqa61.jpg
GodofWar,https://old.reddit.com/r/GodofWar/comments/ho3eoi/we_all_wanted_to_kill_that_little_shit/,7314,131,We all wanted to kill that little shit,,https://i.redd.it/leu0cfxq6u951.png
GodofWar,https://old.reddit.com/r/GodofWar/comments/hoh012/so_i_did_an_art_challenge_i_love_the_result_oc/,7258,88,So I did an art challenge.... I love the result [OC],,https://i.redd.it/y35thfos0y951.jpg
GodofWar,https://old.reddit.com/r/GodofWar/comments/1e6x14s/the_god_of_hope_ruler_of_the_nine_realms/,7204,135,"The God of Hope, Ruler of the Nine Realms","I saw the artwork done by Hayder on X (link to profile -
https://x.com/haydernaqashy
) and I loved it. However I wanted to see the weapons resemble their in-game look so I edited it onto the painting. Also added his shield in the closed position on his stage left hand.",https://i.redd.it/qkfzry626fdd1.jpeg
GodofWar,https://old.reddit.com/r/GodofWar/comments/hzjat0/new_to_the_game_and_liked_mimirs_reaction/,7189,96,New to the game and liked mimir's reaction,,https://i.redd.it/5mh8nyarymd51.jpg
GodofWar,https://old.reddit.com/r/GodofWar/comments/iuqko0/me_trying_to_convince_myself_that_i_dont_have/,7094,159,Me trying to convince myself that I don’t have enough money for the PS5,,https://i.redd.it/41vkijq9frn51.jpg
GodofWar,https://old.reddit.com/r/GodofWar/comments/po1h0u/im_sorry/,7055,234,I'm sorry.,,https://i.redd.it/scyl53i9mgn71.jpg
GodofWar,https://old.reddit.com/r/GodofWar/comments/znkf90/santa_monica_i_implore_you_bring_back_the_fur/,7044,208,"Santa Monica, I implore you, bring back the fur coat in NG+",,https://i.redd.it/i9vzdkagra6a1.png
GodofWar,https://old.reddit.com/r/GodofWar/comments/k27gcv/atreus_asked_a_stupid_question/,6984,203,Atreus asked a stupid question,,
GodofWar,https://old.reddit.com/r/GodofWar/comments/m1e5br/reality_is_often_disappointing/,6962,75,Reality is often disappointing,,
GodofWar,https://old.reddit.com/r/GodofWar/comments/iy3ahq/2_years_late_im_here_i_just_finished_the_main/,6850,167,(2 years late) I’m here! I just finished the main story for GoW,,https://i.redd.it/qz1lihiwoto51.jpg
GodofWar,https://old.reddit.com/r/GodofWar/comments/1ifdz0y/playing_god_of_war_as_a_father/,6829,113,Playing God of War as a father,,https://i.redd.it/yc7ppk8hvkge1.jpeg
GodofWar,https://old.reddit.com/r/GodofWar/comments/1likysa/a_fine_addition_to_my_collection/,6794,55,A fine addition to my collection,"By ArchaicProps on Etsy
https://www.etsy.com/listing/1191226428/god-of-war-kratos-vase",https://i.redd.it/kc2su5wycp8f1.jpeg
GodofWar,https://old.reddit.com/r/GodofWar/comments/1pepld4/its_funny_that_kratos_never_questioned_how_his/,6790,271,"It's funny that Kratos never questioned how his ""mortal"" wife could easily lift 5,000+ pound logs","Before he knew she was a Jotunn, he must've seen her do stuff like this and go ""hrmm wife strong. good"" and left it at that",https://i.redd.it/6yj6aq0ffc5g1.jpeg
GodofWar,https://old.reddit.com/r/GodofWar/comments/1ddb34y/so_true_lol/,6780,158,So true lol,,https://i.redd.it/lcjvaded9x5d1.jpeg
GodofWar,https://old.reddit.com/r/GodofWar/comments/k7q3d1/from_little_boy_to_big_boi/,6771,59,From little boy to big BOI,,https://i.redd.it/deejrehs2j361.jpg
GodofWar,https://old.reddit.com/r/GodofWar/comments/sap78h/i_understand_now/,6763,300,I understand now,,https://i.redd.it/1tri6hnsged81.jpg
GodofWar,https://old.reddit.com/r/GodofWar/comments/xdkj8i/god_of_war_ragnarök_story_trailer_state_of_play/,6713,1105,"God of War Ragnarök | Story Trailer - State of Play | PS4, PS5",,
GodofWar,https://old.reddit.com/r/GodofWar/comments/1njqkmc/god_of_war_ragnarok_ending_according_to_old_fans/,6696,246,God of War Ragnarok Ending According to Old Fans,Art: made by myself,https://i.redd.it/fwfrohtlrspf1.png
GodofWar,https://old.reddit.com/r/GodofWar/comments/17rdsio/yo_i_didnt_know_kratos_could_get_sturdy_happy_one/,6671,89,Yo I didn’t know Kratos could get sturdy 😭 (Happy one year since launch),,
GodofWar,https://old.reddit.com/r/GodofWar/comments/mwxyo2/god_of_war_2018_ps4_case_animation_i_did/,6652,104,God of War (2018) PS4 Case Animation I did!,,
GodofWar,https://old.reddit.com/r/GodofWar/comments/gcjrdh/not_really/,6628,97,Not really,,https://i.redd.it/ee8ntcanygw41.jpg
GodofWar,https://old.reddit.com/r/GodofWar/comments/1lfcmes/kratos_loves_his_children_calliope_and_atreus/,6562,240,Kratos loves his children Calliope and Atreus equally but treated them so differently - An Analysis,"Because Calliope and Atreus are not the same, with staggering differences in time, place and situation.
There is a misconception that I tend to see too many times: that Kratos didn't know how to be a father. That's simply not true. Perhaps it's the product of many people entering through the Norse games (like myself) and making assumptions.
Kratos already knows how to father. He was openly affectionate to his first child, Calliope. He made her flute, visits her in bed, and speaks to her gently.
Then come Atreus in GoW 2018, Kratos was harsh, distant and dismissive. Kratos was barely in Atreus life that the child believed his father didn't want him.
I've seen people poke fun and joke about the difference of his treatment of his son compared to his daughter. While the memes are funny, I still want to tackle them in serious discussion.
The difference between Spartan Kratos and Norse Kratos.
I won't elaborate much since this is common knowledge. Spartan Kratos with Calliope was a successful man, arguably happy. He had no reason to put on a mask or be distant with his daughter.
Norse Kratos was severely traumatised of causing Calliope's death. His sins caused him self loathing, including his own nature as a god.
Kratos believed his son was better off with little of his involvement. This distance caused their relationship to be strained and awkward at the beginning of the game.
Calliope is a girl and Atreus is a boy.
Yes, I believe this actually matters. Kratos is raised in a society where boys were taken from their mothers to be trained as soldiers. The male upbringing that Kratos knew was that of blind obedience to superiors, competition, violence and discipline.
It's undeniable Kratos' childhood experiences shaped his treatment of Atreus. But in Ragnarok, Kratos admits he did not train Atreus the Spartan way because it was unnecessarily harsh.
While Calliope was initially deemed too weak to pass Spartan standards, once she was healthy there was no expectation for her to become a soldier.
Atreus inherited the things Kratos hated: godhood and rage.
Kratos' desire to impart discipline on Atreus is motivated by love. His rage was destructive and could bring horrible consequences. Kratos spent more than a century bringing his rage under control and desperately wanted to pass this knowledge down to Atreus.
However, of course, this was severely complicated by Kratos not wanting Atreus to learn he was a god, and we already know the consequence (the sickness).
While Calliope also had some kind of sickness (perhaps the same nature as Atreus) and also a goddess, it didn't seem to manifest into a form of rage. Kratos did not have the same drive and need to discipline his daughter.
Kratos saw a simpler future for Calliope, while Atreus' was unclear to him.
With Calliope, the most important job of Kratos would just be to find her suitable husband in Sparta. Ironically, Calliope never had this future. We never had a chance to see if she would ever defy the role led out for her, or if she would follow it wholeheartedly.
In Ragnarok, one the causes of the conflict between father and son was Atreus looking to find his identity and destiny. Kratos could not give his son answers, and all he could provide was training, discipline and protection. Atreus had begun to reject these in favor of independence, action and taking risks.
Despite claiming to not believe in a death prophecy, Kratos was hard on Atreus knowing that one day he might not be there for him.
However, this same uncertainty seemed to have given Kratos a way to appreciate the present. As we learn in the quest with the Hafgufas, Kratos simply wanted to enjoy time with his son while he still could.
End
It got long, and I don't know why. This was supposed to be a Father Day special but like got in the way. Thanks for reading.",https://i.redd.it/krt5xumecw7f1.jpeg
GodofWar,https://old.reddit.com/r/GodofWar/comments/1o90t0j/thor_when_he_accidentally_kills_kratos_or/,6549,359,Thor when he accidentally kills Kratos or something,,https://i.redd.it/r8lci4ny7ovf1.jpeg
GodofWar,https://old.reddit.com/r/GodofWar/comments/109wvp8/the_hateful_except_theyre_filled_with_regret/,6498,275,"The Hateful, except they're filled with regret instead of hate",,
GodofWar,https://old.reddit.com/r/GodofWar/comments/1lguilw/am_i_the_only_one_who_thinks_jörmungandr_has_a/,6489,288,Am I the only one who thinks Jörmungandr has a solid snake design?,,https://i.redd.it/hl0eutfno98f1.png
GodofWar,https://old.reddit.com/r/GodofWar/comments/indj1x/only_cool_people_understand/,6479,43,Only cool people understand,,https://i.redd.it/qva6kw7anfl51.jpg
GodofWar,https://old.reddit.com/r/GodofWar/comments/jfzdv1/and_thats_how_ragnarok_officially_started/,6407,63,And that’s how Ragnarok officially started,,https://i.redd.it/lt6k722zbnu51.jpg
GodofWar,https://old.reddit.com/r/GodofWar/comments/gfzhyx/i_found_this_amazing_art_piece_on_facebook_i/,6400,204,I found this amazing art piece on Facebook... I thought you guys would like it.. Credit towards the talented @SamDoesArts (link in the comments),,https://i.redd.it/mhafdvkrblx41.jpg
GodofWar,https://old.reddit.com/r/GodofWar/comments/100o48u/i_finished_my_blades_of_chaos_u_people_were_right/,6380,215,"I finished my Blades of Chaos. U people were right, wood aesthetic does look Nice",,"['https://preview.redd.it/4a5saekysg9a1.jpg?width=108&crop=smart&auto=webp&s=b703f1c2888fff532ece0b189b21a757203467ed', 'https://preview.redd.it/1dq7plsysg9a1.jpg?width=108&crop=smart&auto=webp&s=c94833fc2aa3ad2e2d0919d6705fd04e29059a06', 'https://preview.redd.it/qp4s000zsg9a1.jpg?width=108&crop=smart&auto=webp&s=745b100ad755472976d59ca752f18f1d8df23bd8', 'https://preview.redd.it/o3vpny7zsg9a1.jpg?width=108&crop=smart&auto=webp&s=ccf13648ff1a078b19bb3c4eedfa93b239659a8f', 'https://preview.redd.it/7xkk32fzsg9a1.jpg?width=108&crop=smart&auto=webp&s=914f0708f3e682d248d503fe21da100799c4586a', 'https://preview.redd.it/3wkpdcjzsg9a1.jpg?width=108&crop=smart&auto=webp&s=c3350585e8ff880a490ea38eaf1dff8bdd25b970', 'https://preview.redd.it/thhl8jnzsg9a1.jpg?width=108&crop=smart&auto=webp&s=f8aa0a5a137fea3d7156a29fdfedbf8a2f9452c2']"
GodofWar,https://old.reddit.com/r/GodofWar/comments/1f253ab/what_in_the_goddamn_fuck/,6312,185,What in the goddamn fuck?,,https://i.redd.it/vuv9ojpo04ld1.jpeg
GodofWar,https://old.reddit.com/r/GodofWar/comments/1dzmfw9/atreuss_scar_is_deep_stuff/,6309,194,Atreus's scar is deep stuff,"I find this detail in Atreus design fascinating, it's a great piece of deep and subtle storytelling.
That scar is never mentioned, they never talk about it, no one in the game even notices the scar and what it is supposed to be. 
We never learn the official story behind it, but through his dialogues and just by observing their relationship, you can tell that Atreus, as a child, was so affected by Kratos's emotional distance and lack of affection, he was so in need of getting his father's approval... that he carved on his own face Kratos's tattoo pattern to ""be more like him"" so he would like him.
Man it's so innocent, so sad and beautiful.",https://i.redd.it/xpqypd2w7mbd1.jpeg
GodofWar,https://old.reddit.com/r/GodofWar/comments/kir9r0/lake_of_nine_god_of_war_artbook/,6296,84,Lake of nine - God of War Artbook,,https://i.redd.it/lkbi36b97x661.jpg
GodofWar,https://old.reddit.com/r/GodofWar/comments/zlxu70/god_of_war_liveaction_tv_series_ordered_at_amazon/,6288,1411,‘God of War’ Live-Action TV Series Ordered at Amazon,,https://i.redd.it/pk70v7qllw5a1.png
GodofWar,https://old.reddit.com/r/GodofWar/comments/qdcxgt/has_anybody_noticed_that_jormungandr_is_watching/,6272,132,Has anybody noticed that Jormungandr is watching when you enter the council of Valkyries? I hope he enjoys the show!,,https://i.redd.it/esytwcoqwyu71.jpg
GodofWar,https://old.reddit.com/r/GodofWar/comments/1gaxm05/what_are_some_of_the_best_lines_in_god_of_war/,6229,580,What are some of the best lines in God Of War?,,https://i.redd.it/i8840303ynwd1.jpeg
GodofWar,https://old.reddit.com/r/GodofWar/comments/z6zcil/break_them_all_leave_none_alive/,6207,113,"Break them all, leave none alive",,https://i.redd.it/zdzf9xh3mp2a1.jpg
GodofWar,https://old.reddit.com/r/GodofWar/comments/z2rfrp/51_mil_gowr_debut_week/,6205,444,5.1 mil GOWR debut week,,https://i.redd.it/hl111b0zbr1a1.jpg
GodofWar,https://old.reddit.com/r/GodofWar/comments/1fs8at2/found_this_god_of_war_easter_egg_in_ghost_of/,6155,59,Found this god of war easter egg in ghost of tsushima!,,https://i.redd.it/exr7o11lyrrd1.jpeg
GodofWar,https://old.reddit.com/r/GodofWar/comments/8e561j/when_youre_the_god_of_war_and_your_kid_keeps/,6159,122,When you're the God of War and your kid keeps talking back,,https://i.redd.it/0kdqbgpw6it01.png
